,date,text,Google compound,Google positive,Google negative,Google neutral
51,2019-06-30 10:00:00,"Bitcoin can be many things depending on the situation. For many it is a store of value, but in Venezuela it is a safety net. Lil Bubble - All Time Lows.Old Town Road - the crypto version.None of this is financial or investment advice. All content is created for entertainment... A study conducted by the Global Blockchain Council revealed that most people agree that purchasing Bitcoin is not easy. And maybe you share the same opinion... Overhead descending resistance forming on Bitcoin could develop a descending channel taking price levels down to $9000 over the coming week. This would. Andreas Antonopoulos is a best-selling author, speaker, educator and one of the world's foremost cryptocurrency and blockchain experts.He is the author of... Anthony Pompliano has declared that he holds a rather significant amount of his net worth in Bitcoin, and is sticking to his predictions. After making a high of $17400, Bitcoin came back down to close below $14460, which is extremely negative for the market. Bitcoin is surging and Libra is shaking up regulators as the globe faces a period of doubt on the economic front. Is the recent bitcoin rally an illusion or is it part of a larger price trend? It's suddenly become a relevant question that is making its mark on Google... If you're bullish on Bitcoin, you'll want to check out Hut 8 Mining Corp (TSXV:HUT). This stock has the potential to really skyrocket if Bitcoin cooperates.",0.5376,0.081,0.056,0.863
52,2019-07-01 10:00:00,"NOTICIAS DE #TECNOLOGÍA del 1 DE JULIOHay una criptomoneda que está creciendo por encima de Bitcoin, tenemos rumores confirmados de la nueva #PlayStation,... Bitcoin is trading at an eye-watering 600% premium in Zimbabwe, as the country's oppressive monetary policy drives investors towards BTC. A new loyalty program enables travelers to earn Bitcoin instead of frequent flyer points, and it's set to roll out to Australian airlines. Blockstream CEO Adam Back — inventor of the hashcash proof-of-work system — says that “bitcoin time” seems to be running faster than the “internet time” of... Binance is planning to roll out a futures trading service, with a test version to be launched in about two weeks time. Data from Google Trends 'search analytics resource reveals that internet googling of 'bitcoin' is now at a 17-month high. Bitcoin's use in illegal online marketplaces peddling everything from drugs to child porn is on pace to set a record this year at more than $1 billion,... As Bitcoin tries to regain some of the lustre it held in late 2017 when it nearly reached US$20000 in value, investors are still questioning how to predict... Two-and-a-bit weeks ago, Alphaville moderated a panel at a crypto conference on crypto exchange ""market integrity and consumer protection"" (which,... Bitcoin technology company, Blockstream, has announced a new tool which allows users to execute atomic swaps on the Liquid Network.",0.4019,0.05,0.034,0.916
53,2019-07-02 10:00:00,"A study by Delphi Capital reveals that 21.5 percent of Bitcoin owners are longterm holders. That is despite recent BTC price scares. Bitcoin is used almost as much on the dark web as it is for real world payments, new research shows. When Bitcoin prices skyrocketed, it made millionaires out of a lot of investors — more than you might think. It's tough to imagine now, but the first pizza... Market on Close:The latest surge in bitcoin has been accompanied by big volume in tether. Watch as Jesse Powell details why the controversy over the... You may have heard of the famous P versus NP problem. If you can prove or disprove its cryptically short equation, you'd be a million dollars richer—and... Nestlé, the largest food company by revenue, announced a pilot program to track its supply chains using blockchain, according to a company statement. CNBC, which has often been considered as a counter trade indicator, has indicated that Bitcoin price may have just found a new floor at $10000. Bitcoin (and a lot of other crypto assets) has enjoyed a recent bullish run, crypto-based apps are not seeing as much love as before. Mt. Gox founder Jed McCaleb allegedly misrepresented fund losses to keep traders on the platform, according to a lawsuit. Venezuela is being crushed by staggering hyperinflation as a sharply divisive political crisis has the economy in ruins. Some are seeking refuge in.",-0.8462,0.057,0.102,0.841
54,2019-07-03 10:00:00,"Erik Voorhees, CEO of ShapeShift; Eric Lombrozo, CTO of Ciphrex; and Aaron van Wirdum, Technical Editor of Bitcoin Magazine. According to a new bitcoin price report, retail investors are getting excited about the crypto asset market once again. Gold and crypto asset Bitcoin have recently become more correlated than ever admist increasing economic turmoil and the trade war between the US and China. When a cryptocurrency fan compared bitcoin favorably to tokens once used for purchases at Chuck E. Cheese, the chain's official Twitter account was quick to... Gold Vs Digital Gold ""BTC"" Economists have been proven wrong. Bitcoin Cash SV Fork Suspiciously Perfect Timing at the peak of Bear Market. Kevin O'Leary and Jeremy Allaire went toe-to-toe on the viability of cryptocurrencies, with the Shark Tank star insisting that bitcoin is for drug dealers. Binance chief strategy officer (CSO) Gin Chao says he believes bitcoin can as high as $50000 to $100000 in this current bull cycle, as per an interview with... An Australian couple who invested their life savings into a bitcoin scam were alerted to the fraud via text message. Advertisement. Last week, the world's largest bitcoin conference took place in San Francisco. Despite bitcoin holding a $200 billion market cap in Q2 2019… Crypto may help to solve microtransaction problems, as gamers are becoming disillusioned with industry leaders.",-0.7783,0.083,0.102,0.815
55,2019-07-04 10:00:00,"Willy Woo is a partner at Adaptive Capital, and cryptoasset analyst specializing in on-chain analysis. Follow him here: https://twitter.com/woonomic Try... The Antminer T17 is equipped with bitmain's second-generation 7nm chip, which uses the world's leading TSMC FinFET technology to apply global optimization... Innovative e-commerce company Patricia has announced that from May 17th 2020, theyll start paying their member of staff in bitcoin. | Pulse Nigeria. The energy demand of the global bitcoin network is massive – but it uses only a quarter of the electricity wasted each year by inactive home devices in the... A remote mining company says it enables individuals to lease hashing power from state-of-the-art mining centers. Facebook's Libra is not a cryptocurrency and won't offer the kinds of protections that Bitcoin does. It's a way for Facebook to track what you buy. A young Canberra couple have been 'financially ruined' after falling victim to an elaborate overseas Bitcoin investment scam which has... The UK's markets regulator has proposed a ban on financial instruments linked to digital cryptocurrencies such as bitcoin, warning that such products could... A ""whale alert"" is a type of Twitter alert that notifies traders when large sums of crypto or Bitcoin is moved from one point to another on the. New research has found that the U.S. leads the world in the volume of tweets referencing bitcoin and Facebook's planned cryptocurrency.",-0.9593,0.046,0.113,0.841
56,2019-07-05 10:00:00,"Let's face it: Cryptocurrency isn't just for geeks anymore. It has absolutely gone mainstream...You can now trade Bitcoin futures and buy stock in online... Bitcoin price charts show a direct correlation to increases on holidays, both national and international, religions or otherwise. Many of the critics of cryptocurrency asset like Bitcoin and Ethereum argue that nobody spends them as they are intended to be, and even less accept it as. Bitcoin price is once again below $11000 ahead of the holiday weekend where volatile price action is expected in crypto markets. Vital, USDT or Tether is a stable coin that comes in play as a safe haven during times of extreme Bitcoin (BTC) price flactuations. Bitcoin price is showing positive signs above the $11200 level against the US Dollar. BTC could surge higher once it breaks the $11600 resistance level in... Much of the conversation surrounding Bitcoin and Switzerland in recent days is focused on the cryptocurrency showing price correlation between it and the. Last month saw the official announcement of a new book and guide to Bitcoin released by Manning Publications. The book, Grokkin Bitcoin, aims to help the. Bitcoin is on course to hit a $1 trillion dollar market cap in its current cycle, and next time will beat gold, Willy Woo has said. Cryptotrader looks at how we should trade in cryptocurrencies and interviews the biggest names in Crypto.",0.9799,0.142,0.018,0.84
57,2019-07-06 10:00:00,"The unstable virtual currency, which plummeted more than 70 per cent in 2018, has enjoyed a phenomenal rally since the turn of the year. Bitcoin's hash rate has reached its all-time high according to data from Blockchain.com. As of July 5, 2019, Bitcoin's hash rate broke 74.5 million tera... Rabat - The Moroccan Central Bureau of Judicial Investigation (BCIJ) has arrested a Palestinian nati. Congress is considering at least three bills that would resolve some of the murky legal issues surrounding digital money. Financial disclosure forms filed this week with the state's ethics commission show that some elected leaders in Alachua and Marion counties saw their wealth... Helen Disney cannot help but feel a pang of regret after selling most of her bitcoin.The cryptocurrency, whose value plummeted more than 70 per cent last...",-0.3672,0.068,0.079,0.853
58,2019-07-07 10:00:00,"Failure to adopt a long view of the Bitcoin's growth potential means investors and businesses are leaving money on the table. Ryan, Paco, David, and special guest Michelle Phan discuss what Bitcoin is and why it's important in today's society. Michelle also shares how she built her... Over the last 4 days, Bitcoin price has been consolidating within a $1000 range clearly forming an asymmetrical triangle. WikiLeaks may have amassed more than $46 million in Bitcoin based on the number of coins held by its known wallet address. During the first part of this year, Bitcoin (BTC) has been very active and it was able to gather the attention of many other investors. Regulatory pressures continue to have an effect on the most popular countries to mine cryptocurrencies. Are new bitcoin rules coming? According to The Wall Street Journal, “the Internal Revenue Service is expected to update its 2014 guidance on... Bitcoin has appeared on television yet again, this time in the third episode of HBO's Euphoria. Kat, a major character on Euphoria, use the coin. Some crypto companies keep wilfully ignoring BCH. Let's compare the coins and see if BCH haters rail against Bitcoin Cash on purpose or simply due to a. CoinDesk details the Chaikin Money Flow indicator, which is used to quantify trend strength around volume and market pressure.",0.953,0.133,0.055,0.812
59,2019-07-08 10:00:00,"There are a lot of loopholes in the conversation around bitcoin and its annual energy consumption rate, says a clean energy specialist. Professor Katrina. The popular cryptocurrency exchange Binance is celebrating its second anniversary with a new €100000 giveaway promotion. The bitcoin price is poised for a brutal 80% correction according to veteran trader Peter Brandt. After a parabolic run-up, traders should brace for a fall. Bitmain Technologies Ltd. co-founder Wu Jihan has marshaled a group of the mining giant's former employees to launch a new cryptocurrency financial services... Bitcoin has landed front and center in the ongoing debate over benefits of cryptocurrencies and impact on the environment. Though Bitcoin's second layer is mostly appreciated for its speed and scalability, it also helps enable some interesting smart contract functions. Deutsche Bank winding down its investment banking arm paints a bleak picture of traditional finance at a time of booming growth for bitcoin and crypto. Cryptocurrencies are not recognised as legal tenders in the country and the issue of allowing trading in such currencies is being examined by the government... Award-winning crypto analyst Gary McFarlane interviews a blockchain lawyer and discusses a crypto ban. Bitcoin has run into difficulty staying put above... Over the years there's been no shortage of creativity when it comes to innovative new Bitcoin mining efforts. We've seen mining rigs built in the back of...",0.9654,0.156,0.063,0.781
60,2019-07-09 10:00:00,"I wrote a SHA-256 algorithm for the Apollo Guidance Computer (AGC) and ran it on the AGC we're restoring. The video shows the Bitcoin hash output on Carl's... A man who once mined Bitcoin on a punch card IBM mainframe, had some interesting results when he tried to mine Bitcoin on the computer that took man to the... Ken Shirriff is a man with a passion, and he has converted an Apollo space mission guidance computer into a Bitcoin mining rig. Mining cryptocurrencies often requires a lot of dedicated hardware. Even where most altcoins are concerned,… Bitcoin price is already up around 70% over the past year but two Bitcoin bulls believe it's just the start of the next parabolic move up and this week... In this episode, the CEO of FTX and Alameda shows you his quantitative trading strategy and is focused on trading Bitcoin (BTC). During this quant trading... Silicon Valley venture capitalist Chamath Palihapitiya, an early investor in bitcoin, is still crazy about the cryptocurrency. ""It's the single best hedge... Bitcoin mining difficulty has grown faster in the last two weeks than in any period since August 2018, a sign that competition is heating up. Chia Network is launching a $100000 contest with prizes for developers who use its Proof of Space method to create a more efficient cryptocurrency. A new International Energy Agency analysis provides a useful look at a tricky problem: tracking the energy consumed by digital Bitcoin ""mining"" to process...",0.9741,0.138,0.049,0.813
61,2019-07-10 10:00:00,"Chamath Palihapitiya, a Silicon Valley venture capitalist, says Bitcoin is the perfect “schmuck insurance” that investors should hold. Bitcoin price created a rising wedge as short-term price action tests the 0.5 fib level between $13000 & $14000 twice over last 20 Days. Ever wonder what Lionel Messi would make per year if he was paid in Bitcoin? A new website ranks top athletes by their salaries in BTC. Is it a coincidence that an Estonian startup began testing blockchain in 2008—the same year that the pseudonymous Satoshi Nakamoto published his pioneering... Data from Binance Research shows that the Bitcoin network has seen its highest hash rate growth over a 30-day period. This revelation reiterates the... Another big move by Bitcoin has seen the king of crypto break a crucial level of resistance which could result in greater gains this week. There is no. Korean messaging giant Kakao notes the Klaytn blockchain platform has a higher transaction throguhput with 300 transactions per secon against Ethereum's 20... Philip Green triggered the wrath of crypto proponents online as the ECB says it has no plans to add bitcoin to its reserves. Facebook is the latest major company to step into the world of cryptocurrency, and its first foray into these volatile waters has made big ripples,... BitIRA — pioneer of the first insured cold storage solution for cryptocurrency retirement accounts — has launched its newest tool, the “My BitIRA” investing...",0.9081,0.078,0.018,0.903
62,2019-07-11 10:00:00,"The Symphony of Blockchains team at IOHK has released an update to the project — Symphony 2.0 which shows a 3D representation of the Bitcoin blockchain. The cryptocurrency industry is attracting a lot of excitement and a lot of scammers. Some scammers even impersonate well-known figures, like Elon Musk,... During the Bitcoin 2019 conference in San Francisco, BTC Inc CEO David Bailey spoke with former NSA subcontractor and privacy advocate Edward Snowden. It seemed like yesterday when the price of bitcoin dropped more than 80 percent from its all-time high of $20000. The moment half the renowned economists. Tyler and Cameron Winklevoss of the New York-based Gemini cryptocurrency exchange, want to work with Facebook CEO Mark Zuckerberg on Libra. Iran will adopt a strangely paradoxical stance on Bitcoin as it legalizes mining while maintaining a ban on trading. Let's see how that works. You can buy any cryptocurrency you like with Tether (USDT), but it's difficult to find anyone who'll give you a US dollar for it. Why is that? If you like burgers and bitcoin, there's no better event for you than western Sydney's first ever crypto meet-up at Downtown Brooklyn burger bar in Penrith. Monroe College is ""under cyberattack"" by hackers who demanded approximately $2 million in Bitcoin, police and school officials said Thursday. China's Bitmain said it would build the world's largest bitcoin mine in Rockdale, Texas. Then the price of bitcoin plunged, taking with it the town's hopes...",0.5719,0.075,0.049,0.876
63,2019-07-12 10:00:00,"The crypto industry, Bitcoin, blockchain, and any of its varieties is driven primarily by hype and speculation as the emerging technologies underlying. Ever since US President Donald Trump shared his thoughts on Bitcoin in a blistering tweet from last July, crypto investors have been nervously anticipating... Bitcoin price levels have pulled back to POC (Point of Control) around $11300 as mentioned in my previous bitcoin price analysis. At a block height of 584802, AntPool mined an invalid block and was forced to forfeit their 12.5 BTC block reward. The rejection came as a result of an... The IRS may subpoena tech firms like Apple, Google and Microsoft in search of taxpayers' unreported crypto holdings. In a new interview, Bitcoin investor and ShapeShift founder Erik Voorhees predicts that Bitcoin will soar as high as $200,000 in 2020. Fed Chairman Powell has said that a globally prevalent cryptocurrency could conceivably remove the need for reserve currencies. The loss follows a series of big hacking attacks on cryptocurrency exchanges. Donald Trump has revealed he is “not a fan” of bitcoin or Facebook's Libra in his first public comments on cryptocurrency. In a series of tweets, the US... Police in eastern city of Zhenjiang confiscate almost 4000 of bitcoin mining devices.",-0.9081,0.039,0.101,0.86
64,2019-07-13 10:00:00,"The downward slide continues today as bitcoin drops closer to support once again. Meanwhile, Tether printers keep churning out more USDT. At just 11 years old, Andrew Courey found himself fascinated with the concept of cryptocurrency, specifically Bitcoin. But he struggled to find resources... White House economic adviser Judy Shelton made headlines last week after President Donald Trump nominated her to the Federal Reserve Board of Governors. Bitcoin Norway Shuts Down Due to Theft via SIM Swap Hack and ""Sophisticated Spear-phishing Techniques"". | Crowdfund Insider: Global Fintech News, including. It's the year 2019, anything that goes viral turns into a meme or a gif which gets circulated all over the internet making people laugh and sometimes... Besides fat-fingered whales, the other species HODLers should learn to fear are large-scale Bitcoin miners whose electricity cost is zero. The reason? The bitcoin and cryptocurrency world has been reeling today after U.S. president Donald Trump last night unleashed a scathing attack on bitcoin and... As Bitcoin ATMs are not usually listed on Google Maps, you would need to use other tools to locate them. Let us now have a look at some of the available... Aman Natt is a courageous person and his determination helped him to enter into the world of Bollywood where he is going to produce a movie on tech-savvy... Georgia has exempted cryptocurrencies from value-added tax (VAT), as Bitcoin.com reported on July 13. Per the report, Georgia's finance minister Nodar...",0.8834,0.085,0.045,0.871
65,2019-07-14 10:00:00,"John McAfee remains confident that Bitcoin price will reach his $1 million projection by the end of 2020 and he isn't bothered by weekly corrections. As this Sunday trucks along, it has become rather apparent the cryptocurrency markets are getting battered once again. Despite a rising Bitcoin Dominance... President Trump's recent Bitcoin tweet might make cryptocurrency a discussion point for the 2020 election and crypto investors think this is a good thing. Bitcoin whales are attempting to shake out emotional traders today, as the price finds itself back on the main support of a bullish pennant. Police in eastern China busted a bitcoin mining operation following a surge in local electricity usage, according to a wire report from Agence France-Press. The cryptocurrency markets fell sharply on July 14 after bitcoin endured a $1400 sell-off, denying the bulls a chance to revisit 2019 highs. With experts reporting in recent months that crypto winter is now over, things are hotting up in the SA crypocurrency scene — with five major SA crypto... Fortunately, for cryptocurrency users, there are also bitcoin cashback reward platforms that pay shoppers small rebates in bitcoin when making purchases... The alleged Ponzi scheme trading as Bitcoin Wallet has taken monies from thousands of South Africans but is unable to return their investments. Donald Trump, the racist President, represents everything that the cryptocurrency industry stands against. We will not be complicit.",-0.0436,0.058,0.042,0.9
66,2019-07-15 10:00:00,"Traders believe Bitcoin is headed for an extended uptrend. For BTC to reach ATH, traders pinpoint $13k as the main resistance level. For years, scammers have been contacting strangers via phone, email, text and Facebook Messenger. Now scammers are turning to a new platform: WhatsApp,... If you're thinking about dusting off your ASIC, you may want to pack your bags as well. Here are the top 5 cheapest places to mine Bitcoin. Former Texas congressman and presidential candidate Ron Paul joins 'Squawk Alley' to discuss cryptocurrencies, regulation and the tech behind them. Ennesima bufala che riguarda la truffa d Bitcoin Future: stavolta ad essere tirato in ballo è Matteo Salvini, che sarebbe andato a Pomeriggio Cinque,... Ethereum co-founder Vitalik Buterin believes that Bitcoin Cash has the best network to become a temporary scalability solution for Ethereum. The new Bitmain facility was going to bring hundreds of jobs to the former coal town, but that changed when Bitcoin's value plummeted. As House and Senate committees gear up for hearings on Facebook's Libra cryptocurrency this week, let's break down why the structure, technology, and goals... The average block size suddenly jumped from around 1 megabyte to over 3 megabytes — by far the highest average in Bitcoin's history. It would take well over a quintillion years for the Apollo Guidance Computer used in the moon landings to mine a single Bitcoin block.",0.3506,0.065,0.033,0.901
67,2019-07-16 10:00:00,"Alibaba's international e-commerce website announced on Monday that it would ban the sale of cryptocurrency mining machine products from October 8. A weather app is generating 96 percent of total transactions on the Bitcoin SV blockchain, according to CoinMetrics. The Massachusetts-based data. Global financial markets are bracing for a predicted global recession. We asked top blockchain leaders what they think will happen to Bitcoin if a downturn... Another falling wedge has formed visible on all timeframes and could propel Bitcoin price levels back up towards visible range highs over the coming weeks. BitMEX on Monday released the unedited video of its CEO Arthur Hayes debating noted economist Nouriel Roubini about bitcoin. TEL AVIV, ISRAEL / ACCESSWIRE / July 16, 2019 / FIRST BITCOIN CAPITAL CORP (OTC PINK: BITCF) (""the Company"") a prolific generator of more than 100 unique... Everything you need to know about municipal cryptocurrencies and where in the world they are being implemented. Comparing Bitcoin to currencies such as the Venezuelan Bolivar (VEF), BTC has almost tripled in value against the Bolivar this year. Twenty-two people have been arrested in Jiangsu province for stealing electricity to mine Bitcoin. According to the Paper, the power authority of Zhenjiang... Another tranche of stolen funds have hit exchanges and are being exchanged for other cryptos, according to a new analysis.",-0.9295,0.023,0.08,0.897
