,date,text,Google compound,Google positive,Google negative,Google neutral
17,2019-05-27 10:00:00,"Start trading Bitcoin and cryptocurrency here: http://bit.ly/3uk1YyLBlockchain technology is a way of managing a ledger of records in a decentralized manner... After swiftly gaining 10.7% in less than 24-hours, Bitcoin price reached a new 2019 high and is a mere $1200 away from $10000. Learn more about Paxful and the endless financial opportunities with bitcoin!Buy and sell your bitcoins here: http://bit.ly/30NslhMFollow us on Facebook:... An app that claims to enable users to earn BTC and ETH automatically is a front for ransomware and Trojans, a security researcher claims. Bitcoin has set a new 2019 record having reached $8, 905 before a slight retrace. The world's largest cryptocurrency by market capitalization broke the... In recent weeks, Bitcoin and other cryptocurrencies have begun to show life once again,. The bear market is in the rear view mirror now that a bottom has. In the previous article, we introduced Litecoin (LTC) right from its development history to its working mechanism to how transactions are recorded in its... Can Bitcoin divide couples? While on the one hand, it aids deceitful spouses to hide their investments, it also creates a problem when one spouse invests in... SPONSORED | There's no standard or global Bitcoin price; it depends on supply and demand in each market. Bitcoin has retreated from 12-month highs over $8900 hit earlier today, but prices are holding well above key support at $8390.",0.8244,0.084,0.043,0.873
18,2019-05-28 10:00:00,"We recently sat down with Abra CEO, Bill Barhydt, to have a chat with him about their latest developments in crypto & stock investments. Bitcoin buyers are fighting to remain inside a sideways BTC/USD channel as bears attempt to take back control of the asset. Bitcoin is having a spectacular recovery, but it isn't even in the top five best performing cryptocurrencies for the year. Vitalik ButerinNouriel Roubini. The bitcoin price has more than doubled in 2019, but there is still work to be done if this digital asset is going to fulfill its potential. The price of Bitcoin continued to rise on Monday and updated the annual maximum once again; its rate is approaching $9,000. The rise was caused by demand... Picking the right bot for automated trading may be difficult, but this comprehensive review of the top 7 best Bitcoin trading bots will surely alleviate the... Finance watchdog the Financial Conduct Authority (FCA) has issued a warning about crooks targeting people in the UK while claiming to be regulated financial... Following Coinnest's closure, South Korea's bitcoin trading volumes reached an all-time high on LocalBitcoins. This article was originally published on ETFTrends.com. With Bitcoin, the largest digital currency by market capitalization, creeping towards $9,000 and on...",0.978,0.149,0.035,0.815
19,2019-05-29 10:00:00,"In recent weeks, as Bitcoin price skyrockets, interest in the crypto market has been revived once again. And with it, so has the “digital gold” moniker. 'Satoshi's sister' made a bold prediction about Bitcoin SV's price eight days ago. After a massive pump it shows every sign of coming true. Binance Coin's meteoric rise over the past 4 weeks could be about to end, as cracks begin to appear in the 4-Hour price performance. With Abra anyone, anywhere around the world can invest in stocks, commodities, indexes and ETFs using crypto-collateralized contracts made possible by... Egypt is considering legislation that would let the central bank issue licenses for cryptocurrency-related activities. Picking the right trading bot is crucial for generating sustainable passive income. Luckily, U.Today is here to help. Cryptocurrency, especially bitcoin, has exploded onto the scene in recent years. Despite the considerable drop in price since the late 2017 highs,... iTunes gift card market is one of the top online investments that many Nigerian youths involved in as they regularly trade these gift cards for fiat... The following is a guest post from Tucker Mathis, the CEO of FINSYNC, a consolidated cash flow management platform focused on helping. Mining remains one of the most effective ways of earning cryptocurrency. You can make it real with the help of different programs.",0.9855,0.154,0.0,0.846
20,2019-05-30 10:00:00,"Cryptocurrency exchanges pepper the virtual landscape with a kaleidoscope of options. Among them are a series of industry heavyweights that have been in... Bitcoin price finally made it to $9000. But the celebration was short-lived and a sharp drop followed before anyone could celebrate. What is bitcoin, and how do you get rich off of it? In his new book, author Ben Mezrich tells the story of how the Winklevoss twins – known to most as the... A mysterious investor is using the services of an exclusive peer-to-peer network in an attempt to buy 25% of the current circulating supply of Bitcoin. In this tutorial video, we walk you through setting up Casa App - an advanced 2 of 3 multisignature Bitcoin key manager.For written instructions on how to... The one and only Max Keiser, once again spoke to Bitcoinist. He shares his thoughts on where he thinks Bitcoin price is now headed. Welcome to Paxful School!So, you've decided you're ready to buy Bitcoin for the first time, here's how to do it! When you head to the Paxful homepage,... Let's take a look at how the Fibonacci Extension Tool is used and how well it works on Bitcoin price analysis and BTC trading charts. Bitcoin buying is set to skyrocket as Coinstar is ramping up the number of locations to over 2200 across the United States. As Bitcoin battles to reach $9000, Fundstrat Head Analyst Tom Lee says that the real FOMO will kick in when Bitcoin reaches $10000.",0.9799,0.131,0.023,0.847
21,2019-05-31 10:00:00,"This entrepreneur, author, and investor believes useful crypto assets like Bitcoin are here to stay and massive prices are an inevitability. During the flash crash, Bitcoin price in Canadian dollars fell from its trading range around $11250, to a low of $101.20. He continued to stress that the central bank digital currency would not be a current reserve account, nor a private crypto asset. A series of new metrics for gauging Bitcoin demand including one called 'Bitcoin Days Destroyed' suggests 'the market bottom is behind us. Best-selling author and former hedge fund manager James Altucher is not backing down from his $1-million-dollar bitcoin call that he boldly made back in... (Bloomberg) -- Bitcoin has a lingering problem that few people are talking about amid the renewed exuberance of the recent price surge. Chainalysis reports that only 1.3% of bitcoin transactions came from merchants in the first four months of 2019 — little changed from the crypto boom years. A BITCOIN tycoon and his glamorous wife have broken their silence over the night a young Dutch model plunged 14 floors to her death shortly after the group... The CBI told the Supreme Court on Friday that it is ready to take over the investigation into the multi-crore bitcoin Ponzi scheme in which several... Has the technology that could lead to widespread adoption of cryptocurrency arrived? Since the mysterious Satoshi Nakamoto first introduced Bitcoin in 2008,...",-0.6351,0.075,0.099,0.825
22,2019-06-01 10:00:00,"Bitcoin desktop wallets allow you to store Bitcoins on your hard drive. This post covers the 6 best Bitcoin desktop wallets around. We've seen the correlation between avocado and bitcoin prices before. So do Trump's new measures against Mexico indicate a 'buy' signal? The institutional and retail crypto markets are much more intertwined than we realize, argues Noelle Acheson, and each needs the other to hit scale. Bloomberg says Bitcoin's price rally masks the 'uncomfortable fact' that people are hardly using it to buy things–– but there's an economic reason why. How does a lottery ticket work on Binance and how can you get one? That will be answered in this article along with more questions regarding the Launchpad. The majority of the cryptocurrency market is in the red after Bitcoin spiked to $9000 and then came crashing down again. The platform will initially offer Bitcoin and Ether trading, as well as margin trading in LTC, XRP and BCH.",0.504,0.044,0.03,0.927
23,2019-06-02 10:00:00,"Cryptocurrencies are not something new, and neither are CFDs (i.e. Contract For Difference, a popular form of derivative trading). Every person involved. Crypto market consolidation continues Monday; XRP, BSV and ATOM still climbing, EOS and Tron falling back. Market Wrap The weekend has seen gains on Crypto... Bitcoin price saw a 3% move to $8833 is bringing the digital asset closer to a retest of the weekly high. Will it happen before this new week starts? Bitcoin Cash supporters have hidden almost 300 wallets across six continents in a 'buried treasure' game to promote their favourite coin. Bitstamp is a cryptocurrency exchange that was founded in 2011. This review covers Bitstamp's services and my personal experience with it. The old stock market adage “sell in May and go away” has proven to be right more often than not. Specifically, this Wall Street advice refers to selling... This new way of looking at the equivalent scarcity of land and Bitcoin was tweeted by Bylls CEO, Francis Pouliot. So what's the price target? Last week, while most crypto traders witnessed a sideways market with Bitcoin price consolidating in the mid-$8000s, on the CAD/BTC pair on the. Michael J. Casey is the chairman of CoinDesk's advisory board and a senior advisor for blockchain research at MIT's Digital Currency Initiative. As Q3 beckons, many cryptocurrencies are nearing major milestones. Here are 5 popular crypto tokens with price-moving events expected soon.",0.9429,0.077,0.007,0.916
24,2019-06-03 10:00:00,"On Monday Tron Founder Justin Sun excitedly tweeted that he had won an auction to have lunch with legendary investor Warren Buffett. Bitcoin is not free from threat of government interference, 'The Bitcoin Standard' author Saifedean Ammous warned mainstream media this week. How worried should you really be about this doji pattern, and how will it affect BTC price? Let's take a look at the Bitcoin price analysis. Every bitcoin hardware wallet increasingly needs something to stand out from the crowd. The D'CENT Biometric has a fingerprint scanner, but is that. BSV Donations: qpuk70ew5rlpcpa0qkc5mz5eaqwjpke2dyrwyzajnjVitalik Buterin on Bitcoin SV | Binance Delist BSVThank You For Watching!Subscribe Today and Hit +... Square Cash lets you pay for goods and services, pay bills, and transfer money to friends and family, all from the convenience of your smartphone. Blockchain News, Opinion, TV and Jobs – News – Morgan Rockcoon, CEO of Bitcoin Inc, of was sentenced today by U.S. District Judge Anthony J. Battaglia to 21... Justin Sun, founder and CEO of two cryptocurrency companies, is paying $4.6 million to have lunch with Warren Buffett. Exploring the place where finance and technology intersect: The latest news on Bitcoin, cryptocurrency, blockchain technology, and fintech. Justin Sun has bid a record $4.5 million to have lunch with Warren Buffett. Can the Tron founder change the billionaire's mind about crypto?",0.704,0.049,0.041,0.91
25,2019-06-04 10:00:00,"To most in the cryptocurrency community, Bitcoin (BTC) is a paradigm-shifting asset with unlimited potential. But to Warren Buffett, one of the world's. Ethereum's Vitalik Buterin believes Bitcoin SV is a fraud but says centralized exchanges like Binance should ""burn in hell"". ""60 Minutes producer"" Andy Court talks about the mystery of bitcoin's inventor, Satoshi Nakamoto, and the challenges of reporting on cryptocurrency. While Bitcoin price has been rocked by another flash crash today, the price action seems to have other ideas a a peculiar pattern emerges. Read our complete review of the Bitcoin & Crypto Loans company BlockFi - Take out a loan or earn money by lending your crypto assets. Bitcoin app Samourai Wallet has managed to raise $100000 in its first round of venture funding.The privacy-focused crypto wallet, which puts emphasis on... Analytical firm Delphi Digital has called bitcoin the “King of the Assets Class Hill” due to the coin's outperformance in recent months. Bitcoin, which has been swinging wildly over recent weeks, has crashed under $8000—losing almost $1000 per bitcoin in a matter of minutes... Luno, a global bitcoin and cryptocurrency exchange, announced today that the Securities Commission (SC) of Malaysia has conditionally approved Luno's... The general manager for Samsung Foundries China revealed that the company had been designing and manufacturing 3nm and 5nm chips for Bitcoin mining.",0.7469,0.087,0.038,0.875
26,2019-06-05 10:00:00,"Mark Karpeles, arrested in Japan after his bitcoin exchange collapsed from massive hacking, has started a business around the same computer technology that... An unfilled $870 dollar gap on the CME Bitcoin Futures chart is spreading worries of another serious bitcoin price decline. Apple is set to launch CryptoKit, a Swift API to perform basic cryptographic operations on its upcoming iOS 13 software release. Despite banning cryptocurrency exchanges, China may still have a big influence on the industry. The recent surge—and drop—in bitcoin prices could have been... While the sanctions imposed on Iran by the United States has undoubtedly taken a severe toll on the nation's economy, the embargo has also stimulated the... Ethereum co-founder Vitalik Buterin has questioned Binance and Bitcoin SV in an interview he gave on YouTube. Buterin called Craig S Wright's Bitcoin SV a... The founder of GoldMoney.com is upset that Grayscale compared gold unfavorably to cryptocurrencies. Martine Paris interviews Brad Stephens about everything from video game currencies to Facebook's GlobalCoin | When the sons of legendary investment banker... In the past 12 hours, the bitcoin price dropped $7432 on regulated crypto exchanges such as Bitstamp, recording a 19 percent drop in a span of nine days. World of Warcraft is one of the biggest games of all time. It was first released in 2004, and by 2009 it had almost 10 million players.",-0.8689,0.028,0.083,0.89
27,2019-06-06 10:00:00,"The latest decentralized finance (DeFi) aims at creating new business solutions built on distributed, permissionless networks. A Binance Research study. Thomas Lee, Co-founder of Fundstrat Global, joins Wei to share his thoughts from a fundamental valuation perspective on the current crypto market and on the... Bitcoin bears have upped their assault in the last hour, driving BTC price down $200 on to the $7700 support below. Since Vancouver police described Bitcoin ATMs as 'an ideal money-laundering vehicle', the council is now considering a ban. Problem solved eh? Bitcoin investment crooks are using social media posts and faked Mirror stories to reel in new victims. The latest version of this sadly common scam begins... Bitcoin has shed $1400 over the last seven days, contradicting gold's 5.4 percent price rise to the highest since February. A new study by CoinShares has revealed that contrary to public opinion that Bitcoin mining significantly harms the planet, 74% of such mining activity is... The enterprise blockchain startup has updated its Pact programming language to allow smart contract execution between private and public networks. A key technical line applied brakes to bitcoin's sell-off earlier this week, but so far the bounce has been shallow, with upside capped around $7900. This evil bitcoin scam is using a FAKE endorsement from football leged Cristiano Ronaldo to lure investors into giving their money to crypto fraudsters.",-0.9717,0.076,0.146,0.778
28,2019-06-07 10:00:00,"What are Blockchain Forks?https://blockgeeks.com/guides/bitcoin-forks-guide/You may have heard of the expressions 'hard forking' and 'soft forking. Bitcoin2 displays all the aspects of a classic scam, yet the superbly named Bitcoin fork briefly blasted its way into CoinMarketCap top 25. Max Keiser delivered a swift putdown of US regulator after he warned national TV cryptocurrencies such as Bitcoin are prone to manipulation. A number of people have filed copyright claims to the Bitcoin white paper in an effort to prove they are Satoshi Nakamoto. Footage has surfaced of a Bitcoin ATM filling a duffel bag with bank notes, as a security guard tries to keep onlookers at bay. Peer to peer bitcoin marketplace, Paxful, and Airtm, a blockchain peer to peer exchange and digital wallet, are announcing a new partnership to enhance the... Bitcoin price analyst Oliver Isaacs thinks BTC will hit $25000 around the end of 2019, due to factors such as China's trade war with the U.S. and signs of... Like many other markets, Bitcoin (BTC) is all about momentum, trends, and patterns. According to analyst Cane Island Crypto, a prominent American. Unwriter has made it possible for Bitcoin SV developers to code without a full node, breaking down another barrier for Bitcoin SV development. To keep readers up-to-date on the latest price fluctuations and trends pertaining to cryptocurrencies, we compiled a list of the week's top stories.",-0.4404,0.06,0.064,0.877
29,2019-06-08 10:00:00,"Bitcoin drop 7.4 percent; Reserve Bank of India could get a boost with the latest draft bill proposing more stringent measures against crypto investors and... Beloved X-Men star Hugh Jackman has announced his retirement from acting to pursue his recent $50 million investment in ... a Bitcoin scam. As bitcoin price continues to hover around $8000, some cryptos, namely Litecoin, LEO, and Binance Coin, continnue to make waves this month. SUBSCRIBE for more speakers ▻ http://is.gd/OxfordUnionOxford Union on Facebook: https://www.facebook.com/theoxfordunionOxford Union on Twitter:... Bitcoin, Ethereum and cryptocurrency dominated headlines in 2017, before an epic crash wiped out billions of dollars in wealth. And after the bubble burst,... The president of Brazil, Jair Bolsonaro, blamed Bitcoin for canceling an indigenous cryptocurrency project, despite not knowing what it is. There are a number of blockchain projects affirming they have a system of on-chain governance that works. But is that true? The CEO of Binance crypto exchange has predicted that if India goes ahead to criminalize crypto, privacy coins such as Monero will boom in the country. A cryptocurrency is a digital or virtual currency that uses cryptography for security and is generally based on blockchain technology, a distributed ledger... There's a reasonable possibility that demand for Bitcoin is being driven from China, according to CryptoSlate's Ali Martinez.",0.6705,0.064,0.044,0.892
30,2019-06-09 10:00:00,"A Wall Street veteran of 22 years believes Mark Zuckerberg is about to become an accidental Bitcoin champion. Bitcoin investors are not really driving the price higher but rather whales are buying low and forcing a short squeeze, just as suspected. E*Trade has begun marketing to Bitcoin and crypto traders via Google search ads, ahead of the launch of their rumored crypto trading desk. Bitcoin investors in the United States are selling off their crypto to pay off capital gain tax. First-time investors in the Bitcoin system software are... From paying for pizza with satoshi (SAT) on the Lightning Network to the 10,000 satoshis being added to the Lightning Torch each time it is passed,... By CCN: A bitcoin analyst and blogger confirms that the recent rise in the bitcoin price was not due to any kind of organic investor flow. A vanity address can be useful in various situations. If you have a business, for example, you can incorporate its name into a bitcoin cash address you A... Bitcoin shill John McAfee, who's on the run from the law for tax evasion, taunted the U.S. government on Twitter, saying they better leave him alone. The bitcoin price has the potential to break above its all-time high by year-end 2019 or early 2020, according to crypto analyst Oliver Isaacs. Since achieving $9000 at most major crypto exchanges, the bitcoin price has dropped to around $7900 by more than 12 percent against the U.S. dollar.",0.8608,0.071,0.054,0.875
31,2019-06-10 10:00:00,"In the early hours of the morning, Bitcoin exploded upward to $8000 from a double-bottom local low set over the weekend around $7500. The rally upset. The process of creating SLP Tokens got even easier with Memo.cash. Watch our tutorial to find out how to create your own in seconds. Create your token here:... Bitcoin price just closed its worst week of 2019. It this a blip in the road, or the start of a bigger correction for BTC/USD? The ongoing legal battle between Dr. Craig Wright, the creator of Bitcoin and originator of the pseudonym Satoshi Nakamoto, and Ira Kleiman, brother of Dr. Bitcoin's bulls need to keep prices above key support at $7432 to avert a short-term bearish reversal. So-called lightning network ""watchtowers"" – a much-anticipated next step for securing the network – are coming soon. Long-time Bitcoin Core contributor Michael Ford has been named the newest maintainer of the open-source software project. The startup behind the privacy-centric bitcoin app Wasabi Wallet recently brought together 100 people to collectively execute a ""CoinJoin"" transaction. Anthony Curtis, resident of Las Vegas for 40 years and publisher of Las Vegas Advisor, talks about the casinos, gambling and where to eat. Bitwage, a startup that helps companies pay their employees in cryptocurrency, has added ether as a payroll option. Announced Monday, companies that want to...",0.4767,0.084,0.062,0.853
32,2019-06-11 10:00:00,"A Bitcoin trader has reportedly committed suicide after losing 2000 BTC - but some question if it's actually a cover-up for an exit scam. Bitcoin ROI over the past 10 years has dwarfed even investment guru Warren Buffett's Berkshire Hathaway by a whopping 722 times. Accounting firm BDO has announced a comprehensive cryptocurrency auditing service - paving the way for the first Bitcoin ETF on the ASX. With Tether's market cap spiking to a new YTD-high right now, should we expect Bitcoin price to follow closely behind? Let's take a look. Bitcoin economist, Tuur Demeester, has been Googling Google for the cities where 'Bitcoin' was Googled the most. Thankfully, he tweeted the results on. Bitcoin The support in Bitcoin's price holds around $7500 in this range, resistance lies at $8000 and seems a bit like a Head and Shoulders pattern is. In the name of the father, the son, and the HODL spirit … amen. Rick Santorum — former Pennsylvania senator, two-time failed Republican presidential... The co-founder of Fundstrat Global Advisors predicts that once Bitcoin (BTC) crosses 10K, FOMO will kick in and its price will quadruple in 5 months. Bytecoin is a decentralised and private cryptocurrency. It was the first privacy coin created with open source code and the CryptoNote protocol. THE EXTRAORDINARY moment a man lay an open duffel bag on the floor to catch a torrent of £20 notes shooting out of a Bitcoin cash machine was captured by a...",-0.4607,0.077,0.081,0.842
33,2019-06-12 10:00:00,"In this article is an account of the growth of Bitcoin casinos and why these crypto casinos are so popular for gamers. 500 years ago the inhabitants of the tiny Micronesian island of Yap used a currency system which anthropologist have discovered had striking similarities to... https://ssimeetup.org/introduction-ion-layer-2-network-decentralized-identifiers-bitcoin-daniel-buchner-webinar-29/Microsoft presented in May 2019 in New... While investigating bitcoin transaction fees, this reporter got stung with a $3.1 fee. Yes really. A decentralized exchange (DEX) is a peer-to-peer (p2p) online service that allows direct cryptocurrency transactions between two interested parties. Barry Silbert, DGG founder and CEO, said that the recent bull market will only continue based on the past price dynamics of bitcoin. Researchers estimate that the annual emissions of CO2 generated by BTC are greater than the entire output of some small countries. Bitcoin turned ten on 3rd January 2019. But, a decade after Satoshi Nakamoto mined the 'genesis block of bitcoin' and made a momentous step towards bringing... Bitcoin firebrand John McAfee once again found himself in the legal crosshairs after he accused the Bahamian anti-corruption czar of corruption. Known via The Social Network as the brothers beaten to the Facebook punch by Mark Zuckerberg, the Winklevoss twins became billionaires – and got revenge.",-0.7385,0.069,0.07,0.861
