,date,text,Google compound,Google positive,Google negative,Google neutral
34,2019-06-13 10:00:00,"Crypto markets still range bound; Bitcoin, BCH and BSV moving marginally, Litecoin, BNB and ADA fall back. Market Wrap It has been another day of It has... Bitcoin could be on the verge of the next bull run, affirms the CEO of one of the world's largest independent financial advisory organisations. South Korea has long been a key region for Bitcoin adoption. Now its government and banks are coming around, Googe Trends reveals an interesting pattern. Bitcoin buyers appear to be eyeing the $8200 above today, but fears of a rising wedge reversal could put an abrupt end to the rising price. Institutional trading platform Bakkt announced the latest launch date for Bitcoin futures - and compared the event to first moon landing. So far, 2019 has been a great year for cryptocurrencies. According to data from Coinmarketcap, the total market cap of the cryptocurrency market increased... Italy is mulling a terrifying currency scheme that could plunge the eurozone into crisis - and trigger mass bitcoin adoption. Listen to the latest CoinGeek Conversations podcast with Kate Hiscox founder and CEO of DRIVE Markets on how she plans to grow the trading platform with the... Before he turned 19, bitcoin bets made Erik Finman a millionaire. Now, the crypto wunderkind says he wants to create a platform for investing in... The virtual currency bitcoin is responsible for the same amount of carbon dioxide emissions as a city like Las Vegas or Hamburg and efforts to reduce its...",-0.0129,0.063,0.055,0.882
35,2019-06-14 10:00:00,"Jun.13 -- Alyse Killeen, StillMark Co. founding partner, discusses the landscape for cryptocurrencies with Bloomberg's Joe Weisenthal, Caroline Hyde and... Bitcoin price is breaking out of a bearish rising wedge pattern right now, as a short squeeze boosted price beyond $8300. Read more about Hottest cryptocurrency is up 360% this year and its name isn't Bitcoin on Business-standard. Litecoin, which has gained more than 330% since... Square is a company best known for its disruptive card payment technology. Founded in 2009 by Twitter CEO Jack Dorsey, the company sells affordable... Bitcoin (BTC) continues to be the King of currencies seting one precedent after another for the cryptocurrency sphere, and the BTC coin price is moving. While we don't often give it much thought, the supply chain is a big part of our lives. It's how we get our food, our clothes, and the fun little gadgets we... The internet can't stop laughing over a video of a Bitcoin machine spitting out dozens of £20 notes at the busy Bond Street station in London. Craig Wright, the controversial creator of Bitcoin SV claiming to be Satoshi Nakamoto, could be facing jail time for fraud. Documents from a Florida court... Block space is limited: The Bitcoin blockchain can only process some 10 transactions per second, at most. To resolve this, Bitcoin's technical community is... Nevada is becoming a blockchain powerhouse as it passes a suite of bills designed to promote blockchain adoption.",0.6847,0.079,0.061,0.861
36,2019-06-15 10:00:00,"Bitcoin price has been stuck trading within a small symmetrical triangle. These continuation patterns tend to suggest another equal sized move down is. Bitcoin is consolidating sideways in a $1500-wide trading range since the beginning of May 2020. While observers anticipate the cryptocurrency to head. The Bitcoin SV founder showed his trademark hot-tempered, ""censorship-resistant"" mood when faced with straightforward questions. The most recent push in Bitcoin price by bulls has resulted in the Relative Strength Index, or RSI, reaching full power. The commonly used trend-strength. Bitcoin price has been flying over the last few weeks, ever since the cryptocurrency broke free from its tight trading range and took out $10K resistance. The latest rally in Bitcoin has caused the Relative Strength Index to reach shocking highs. Such a reading would typically indicate a pullback is due, The infamous $10000 resistance level has proven to be a significant obstacle for Bitcoin to overcome. From a technical perspective, this barrier is part. As Bitcoin and the rest of the crypto asset class enter the early phase of a new bull market, investors and analysts are hard at work developing a plan to. 2019 saw a number of large crypto exchange hacks, resulting in millions of dollars stolen per attack. Here are 5 of the biggest breaches in the last 12. Bitcoin is back! Please support our sponsors and donate to help fund Episode 3!Celsius App: https://celsiusnetwork.app.link/k8VAFyHv6Y Reasons to Use Bitcoi...",0.7318,0.104,0.076,0.82
37,2019-06-16 10:00:00,"Crypto markets still holding on to weekend gains; Bitcoin is dominating things, XRP, Cosmos and NEO moving up, ETH retreating slowly. Several new users are now entering the cryptocurrency industry and while they want to buy cryptocurrencies especially Bitcoin, they are. Famously portrayed in ""The Social Network"" as the pair of Harvard athletes who believed Mark Zuckerberg stole their idea for Facebook, they're now famously... Crypto mining giant Bitmain is locked in a legal battle with former employees who started a rival bitcoin mining pool, Poolin. Though Bitcoin is still arguably a very speculative asset, support for it as a store of value is proving more resilient than many predicted. By CCN Markets: Tyler and Cameron Winklevoss shared the rundown on “CBS Sunday Morning” alongside Father's Day, Tim Allen and the latest edition of Toy... The Winklevoss twins were featured on ""CBS Sunday Morning"" to discuss their early investment in bitcoin and rivalry with Mark Zuckerberg. Justin Sun's upcoming lunch with Warren Buffett is a genius marketing play that can only help the cryptocurrency sector, writes Noelle Acheson. DUBAI: Bitcoin prices are now reacting to real world problems such as trade wars among others. In 2017, the parabolic rise in Bitcoin prices was speculative... Facing a slowdown in its core brokerage business, TP ICAP Plc has joined the handful of traditional finance firms opening the door to Bitcoin.",0.7532,0.093,0.054,0.853
38,2019-06-17 10:00:00,"The next bitcoin halving is likely to occur in May 2020 and could have a dramatic impact on bitcoin's price. Learn what bitcoin halving is and how to trade... A bitcoin halving (sometimes 'halvening') is an event where the reward for mining new blocks is halved, meaning miners receive 50% fewer bitcoins for... Let's take a look whether Bitcoin price can continue onwards and upward and breakthrough the $10k psychological barrier. Bithumb and other bitcoin exchanges in South Korea are adopting an FTC directive which makes them more responsible for user losses. Bitcoin mining has increased rapidly in recent years, raising the question of whether it is imposing an additional burden on the climate. Bitcoin.com reminds its uninitiated readers that the site shouldn't be compared to a digital asset. The weekend has been extremely bullish for bitcoin price, which has surged to a new 2019 and thirteen month high lifting the crypto market. Established property developer, Linzen Property Group, is offering investors and home buyers worldwide the opportunity to purchase prime real estate in... A judge sealed the list of bitcoin holdings that self-proclaimed ""Satoshi Nakamoto"" Craig Wright submitted pursuant to a motion to compel. Binance has spread the word that it will launch several tokens backed by major crypto coins on Binance Chain shortly; the first one will be a BTC-pegged...",0.659,0.065,0.046,0.89
39,2019-06-18 10:00:00,"The truth about how profitable it is to buy & hold Bitcoin (aka Hodl). Find out is it really safe to invest in Bitcoin through our Hodl Calc. When we think of cryptocurrency adoption, we assume Japan or the US take the lead. Not according to this latest report. Facebook wants its new cryptocoin, Libra, to become a ""global currency."" But crypto investors and watchdogs have big concerns. Crypto exchange Kuna today announced the launch of a new instant bitcoin (BTC), ether (ETH), and USDT buying service. Facebook's new cryptocurrency ambitions might prove popular, but it won't pull in many existing cryptocurrency fans. The famously decentralized medium... Facebook has announced the launch of a new stablecoin and blockchain called Libra, governed by an association with members including Visa, Uber and others. Despite skepticism and concern about Facebook's reach, the company envisions an alternative financial system based on a new cryptocurrency called Libra. The social network's rumored cryptocurrency has landed, but how it will be received remains to be seen. Bitcoin has again broken its year-to-date highs, climbing to $9478 and within spitting distance of the psychological $10000 mark for the first time since... Bitcoin Billionaires: A True Story of Genius, Betrayal, and Redemption charts the narrative of identical twins Cameron and Tyler Winklevoss, who lost out to...",0.0146,0.071,0.054,0.875
40,2019-06-19 10:00:00,"Crypto billionaire Tyler Winklevoss believes that Bitcoin price will break above $15K shortly after it breaks above $10K. Cryptocurrency purists said that Facebook's plans to launch a new digital coin would not create a true cryptocurrency, though they are holding out hope that... Lately, as the Chinese yuan loses value, interest in investing in Bitcoin has surged. Could BTC be an important hedge against the next recession? It's not bitcoin. It's also not Venmo. It's more like an attempt at the internet-age US dollar. Facebook unveiled a cryptocurrency called Libra yesterday, as well as the Libra Association, a not-for-profit that will oversee all things Libra. John McAfee is doubling down on his bitcoin $1 million price prediction, leaving Tyler Winklevoss' $15000 forecast in the dust. The price of bitcoin rose to $9,469, its highest level in more than a year, just as Facebook rolled out details of its cryptocurrency project. Riviera City officials previously agreed to pay $941000 to rebuild their entire computer network. The Riviera Beach City Commission has decided to have its insurance company pay a Bitcoin ransom, equal to about $600000, the hacker who used a high-tech... This bitcoin evangelist is bridging the gap between the Asian mining industry and global open source developers.",0.7225,0.079,0.056,0.865
41,2019-06-20 10:00:00,"Crypto analysts are warning not to be fooled by strong-looking altcoin charts trading against USD, and that the strength is driven by Bitcoin dominance. Bitcoin price will have little trouble hitting $15000 once resistance at $10000 falls, Tyler Winklevoss believes. The latest monitor report on defunct crypto exchange QuadrigaCX revealed that its CEO misused customer funds. Libra is being touted as a bold move by Facebook to take on Bitcoins. However, there are some major differences between Facebook's digital currency and... The leader of the Uptime team, Brent Bevear, explained the advantages of using Bitcoin SV (BSV) blockchain for its UptimeSV and how to earn BSV. One of the Big Four financial auditing firms, PwC, wants to lend a hand to cryptocurrency businesses and help them track their blockchain transactions. Rivera Beach City agreed to pay $600000 in Bitcoin to hackers who took over its computer system. A Florida city is paying $600000 in Bitcoins to a hacker who took over local government computers after an employee clicked on a malicious email link three... A year ago, during Deconomy 2018, a man who refers to himself as the inventor of bitcoin -- Craig Wright -- was openly accused of fraud and now buzz has it... Software engineer and Bitcoin proponent Vijay Boyapati believes that we are currently in a new bull market. Based on previous market cycles, he argues that.",0.6459,0.083,0.066,0.851
42,2019-06-21 10:00:00,"Cryptocurrency firms will be subjected to rules to prevent the abuse of digital coins such as bitcoin for money laundering, a global watchdog said on Friday... Bitcoin's price passed five digits on cryptocurrency exchanges for the first time in 15 months. Despite gold and silver still trading way below their 2011 peaks, incorrigible bull Peter Schiff is promoting metals while slamming bitcoin as a scheme. TRAT: A Swedish man wanted by the United States for alleged money-laundering in a virtual currency investment scam in the US has been arrested on Koh Chang... Business leaders in Canal Flats are attracting more technology companies to invest in small towns, saying it's not only possible to operate there — it... Bakkt, the crypto initiative of the New York Stock Exchange's owner, the Intercontinental Exchange (ICE), is right on the horizon. Bitcoin, which has again been hitting year-to-date highs, could be increasingly influenced by traditional stock market and currency movers as the likes of... PwC has expanded its auditing tools to include audit and assurance services to those clients that deal in cryptocurrency transactions. Andrew Anglin, the publisher of the Daily Stormer and a neo-Nazi, received a suspicious donation in bitcoin after the Charlottesville riots. During the 2017 crypto bull run, Bitcoin price spent very little time above $10000 once it got there. Around Thanksgiving, Bitcoin broke above $10000.",-0.7845,0.061,0.082,0.857
43,2019-06-22 10:00:00,"The leading crypto asset by market cap has once again reclaimed $10000, considered an important psychological FOMO trigger that could see Bitcoin price. Google Trends shows that interest yet hasn't returned to the crypto market the same way as last time, even though Bitcoin price continues to climb. With a growing influx of optimism, hype, and the next wave of newcomers in the cryptoeconomy, markets around cryptocurrencies are heating up. June 22 — bitcoin (BTC) has crossed the $11,000 line for the first time since March last year today, according to Coin360. The leading cryptocurrency had... Bitcoin surged past $10,000 on Friday evening, and is now selling for more than R164,000 in South Africa – up R14,000 on the day. The bitcoin price rushed past $11000 for the first time in 15 months. Should crypto traders fear an imminent pullback to below $10000? Bitcoin Cash ABC surged by 9.93% on Saturday. Following on from a 5.13% rally on Friday, Bitcoin Cash ABC ended the day at $480. GAP600, an instant bitcoin and crypto transaction engine for exchanges and payment service providers, recently announced successful integration into the... With Bitcoin's price soaring right now, it's more important than ever to think about the long-term security of your crypto. Bitcoin's upcoming ""halving"" - which will drastically reduce the BTC inflation rate - is bullish for the entire crypto market. Here's the proof.",0.936,0.086,0.013,0.901
44,2019-06-23 10:00:00,"None of this is financial or investment advice. All content is created for entertainment purposes only.Lil Bubble NFT collectibles:... Sydney publicist Roxy Jacenko believes she knows the culprits of the now infamous office spray-painting scandal. Tyler and Cameron Winklevoss are portrayed as the good guys this time in Ben Mezrich's new book. Coin tracking apps are fantastic tools for keeping track of the cryptocurrency market, but knowing which one to trust can be difficult. Experts say Facebook's cryptocurrency project Libra has been a catalyst for the price of bitcoin going higher. As you likely know, Bitcoin (BTC) has surged past $10,000. In a jaw-dropping move on Friday, the cryptocurrency rallied past key resistance levels in the... Bitcoin traded above $11000 for the first time in 15 months, recouping more than half of the parabolic increase that captured the attention of mainstream... Binance unveiled BTCB, a new Bitcoin-pegged token that will allow users to trade BTC's value in its ecosystem. But is there a demand? A resurgence of scam campaigns that pretend to be Bitcoin and Ethereum giveaways from Tesla, Elon Musk, and John McAfee are underway. Apparently, Mark Zuckerberg has helped Bitcoin to surge past $10,000 again, a price it first surpassed in 2017 as part of an epic speculative bubble that...",0.7579,0.097,0.06,0.843
45,2019-06-24 10:00:00,"Over the last few months, Bitcoin price has more than tripled from the deepest depths of its bear market lows, and is well on its way to revisiting its. TO WIN A $50 VOUCHER, post your most-accurate Bitcoin's price prediction of what it will be next Monday (July 1) in the comments under this video. Tether's parabolic rise has started to show signs of weakness, after $80 million disappeared from the USDT market over the weekend. Is this an early. We take an indepth look at the Abra App Wallet in our review - Is it safe to use? What are the fees like? Everything covered with pros & cons. Bitcoin rate today has broken the dry spell and soared above $1000 mark for the first time in 15 months. Over the past 30 days, more than 98% of transactions on the Bitcoin SV network have been used for recording weather data. The price of bitcoin has surged above $11,000 (£8,600), its highest level in 15 months, amid renewed hype over cryptocurrencies after Facebook said it was... The euphoria over bitcoin price's climb to a new 2019 high above $11000 couldn't last forever, and it wasn't long before drama broke out on Crypto Twitter. Read more about Facebook's Libra coin could define the future of money more than Bitcoin on Business-standard. The future of money is in play and Silicon... Bitcoin did fall over 80% in 2018 but has since recovered back sharply. How is this possible if it was a bubble in 2017? May be fiat money is.",0.6377,0.049,0.033,0.918
46,2019-06-25 10:00:00,"Making money with Bitcoin is easy, right? Just HODL for long enough and reap the rewards.. But what if you want to do more? Following this week's crypto crash, an early Street bitcoin bull ups his price target 400%. In another win for OKLink, launched today its Bitcoin Block Explorer platform, with the promise it was looking to offer similar explorers for other popular... Bitcoin has traded in five-figure territory before, but these crypto experts say that this trip past $11000 is nothing like 2017. Guest Post. It may come as a surprise to many that Bitcoin has gained so much popularity in Nigeria despite the volatility the cryptocurrency experienced in... Bitcoin's price topped €10000 on Tuesday, hitting the highest level seen since late January 2018. Ten years ago, bitcoin was only a philosophical research paper for a new type of digital currency. Even five years ago, most people outside the tech sphere... LedgerX just got the green light from the CFTC to offer physically settled bitcoin futures to retail investors. MSP pays hackers over $150000 in bitcoin for ransomware attack recovery. Hackers apparently leveraged stolen credentials to access RMM & cybersecurity... The chief market analyst of ThinkMarkets says BTC will probably hit $60000 to $100000 during its next bull run.",0.5807,0.103,0.078,0.819
47,2019-06-26 10:00:00,"Bitcoin price is trading nicely above the $11500 and $12200 support levels against the US Dollar. BTC price is currently consolidating and seems to be... Bitcoin's bull run was temporarily derailed as outages at several crypto exchanges caused prices to drop more than US$1800 in less than twenty minutes. The world's first cryptocurrency ATM opened for business in a Canadian coffee shop on October 29, 2013, and by the end of the day, 81 people had visited the... The Bitcoin FOMO rally is truly underway, as the #1 cryptocurrency extends its meteoric rise by a further 9.4% today. With so much momentum picking up. We already know that the average Bitcoin user is a millennial male, but by studying Google analytics, Coindance uncovered a few more Bitcoin demographics... There are so many reasons to keep your Bitcoin Cash transactions anonymous. You might want to avoid becoming the target of hackers, you may be considering a... As the price of a single Bitcoin continues to reach toward its all-time highs from late 2017, a more tangible, delicious and common item is seeing its value... BITCOIN is hurtling toward $13000 (£10249) as the world's biggest cryptocurrency extends gains to jump to an 18-month high. Bitcoin miners in Iran are finding an unlikely new home after authorities blamed them for using too much electricity and seized hardware. SEC Commissioner Hester Peirce (aka - Crypto Mom) says the SEC should've approved a bitcoin ETF already, and slammed the agency for being backward.",0.8083,0.09,0.051,0.859
48,2019-06-27 10:00:00,"One of the regular financial analysts on CNBC's ""Future's Now"" segment has argued that the sharp drop in the Bitcoin (BTC) price over the last 24 hours is. FREE REPORT: 5 Things You Must Know About Bitcoin and Cryptocurrency:https://signup.moneymorning.com.au/X920V6BJThis week, Money Morning answers your... Remember what was happening in the markets last December? Forget the ""Santa Claus Rally"" -- stocks were crashing, and so were cryptocurrencies. Bitcoin fell... A much-needed steep correction has finally arrived to cool off Bitcoin's month-long parabolic uptrend, for the first time in over 40 days. It's easy to buy bitcoin and other cryptocurrencies. Here's a guide on how to buy bitcoin using Coinbase. It's a crypto chicken-and-egg story for bitcoin. Internet searches for bitcoin are on the rise and that has come as bitcoin prices have been rallying. Lake City became the second Florida city in two weeks to agree to pay a large ransom demanded by hackers who shut down public computer systems. Following yesterday's rally, an unexpected crash of the major cryptocurrency exchange Coinbase seemingly brought the crypto bull run to a grinding halt. Are you a cryptocurrency user looking to establish an online business, an internet community forum or even just create a fan page dedicated to your cat? The Grayscale Bitcoin Trust is often discarded as a potential investment because it carries a premium over its bitcoin holdings. However, I don't think this...",0.8718,0.094,0.061,0.845
49,2019-06-28 10:00:00,"The number one and two crypto assets by market capitalisation are currently trading at a large premium across South Korean exchanges. Bitcoin is selling... Max Keiser tears up his fiat! Says its all worthless compared to Bitcoin!One of the best interviews I have done! Morgan Creek Digital Co-Founder, Anthony Pompliano, has discussed the extent of his personal Bitcoin holdings in a gripping interview with Ran Neuner. Bitcoin Evangelist, Anthony Pompliano discusses his personal Bitcoin holdings, his bold $100k price target and Libra!Don't miss this! Subscribe to our channel! rupt.ly/subscribeIranian State TV released footage of 1000 Bitcoin-mining machines in two abandoned factories after they were seiz... The cryptocurrency market is trending up after a flash crash by bitcoin on Wednesday followed by across-the-board losses on Thursday. Bitcoin SV (BSV) rebounded to the tune of 21% following the crypto market's disastrous crash. Did this suprise mention on Joe Rogan help it along? Satoshi's Treasure has released its fourteenth clue that comes in the form of an image. The one who unlocks the private keys hidden in the image will get... More than 100 people have lost between €5000 and €132000. tZero launched a hack-resistant tZERO Crypto App for trading and storing cryptos (Bitcoin and Ethereum initially). Its private key recovery system allows...",-0.8236,0.077,0.101,0.822
50,2019-06-29 10:00:00,"Threatened by Bitcoin & the recently launched Libra, governments & bankers are asking for stricter scrutiny over crypto assets. NEW USB MINER COMPAC F NOW 5X FASTER THAN NEWPAC - 3X USB Compac F Kit 1.05TH/s... The Bitcoin price is less likely to go lower due to external factors in its current bull run, one of the cryptocurrency's analysts said. The crossover between the gaming and crypto demographics suggests two worlds destined to collide. Could gaming be the bridge to Bitcoin? Paying or getting paid with digital coins is the norm in the cryptocurrency sector. Participants in many other industries, however, may also be tempted to... WEST PALM BEACH, Florida (BLOOMBERG) - Craig Wright, the Australian scientist who claims he created Bitcoin, said at a federal court hearing in West Palm... Thinking of jumping into Bitcoin? If this week's boom and bust trading didn't scare you away, you might want to do so on a Saturday or Sunday. Surges in weekend activity since the beginning of May account for about 40% of Bitcoin's price gains this year, according to data compiled by Bloomberg. Amid bitcoin's wild price swings, it's worth remembering Bitcoin as a system was designed for systemic stability rather than price stability. Mike Kayamori, the co-founder and CEO of Liquid Group Inc., spoke about how blockchain technology is changing society and associated global trends at The J.",0.6472,0.06,0.028,0.912
